{
  "schemaVersion": 1,
  "zoneId": "zone-a",
  "coordinateSystem": "arkit-world-meters",
  "heightReference": "floor",
  "waypoints": [
    { "id": "start", "position": [0.0, -1.3, 0.0] },
    { "id": "hall-1", "position": [0.0, -1.3, -3.0] },
    { "id": "turn-right", "position": [2.0, -1.3, -4.5] },
    { "id": "destination", "position": [2.0, -1.3, -7.0] }
  ],
  "capturedAt": "2026-10-02T00:00:00Z",
  "notes": "Illustrative coordinates only. ARKit -z is forward and y=0 is the phone height where the session started, so the floor is roughly y=-1.3."
}
